;_id;news_title;first_crypto;second_crypto;third_crypto;source;news_link;publication_date;pos_votes;neg_votes;imp_votes;com_votes;like_votes;dislike_votes;lol_votes;save_votes
419;14623907;Биткоину прогнозируют рост до миллиона долларов в этом десятилетии. Как это случится?;BTC;;;2bitcoins.ru;https://cryptopanic.com/news/14623907/post-14623907;2022.03.19;;;;;1;;;
420;14623556;actual gas fees flipped $ETH gas fees #Vitalik #Ethereum h/t1thousandx;HT;HPT;HBTC;@huobiglobal;https://cryptopanic.com/news/14623556/actual-gas-fees-flipped-ETH-gas-fees-Vitalik-Ethereum-ht1thousandx;2022.03.19;;;;;;;;
421;14628525;The call for proposals for #PolkadotDecoded 2022 is closing in 3 days now! Don't miss your chance to share your vis…;DOT;DOT;;@polkadot;https://cryptopanic.com/news/14628525/The-call-for-proposals-for-PolkadotDecoded-2022-is-closing-in-3-days-now-Dont-miss-your-chance-to-share-your-vis;2022.03.19;;;;;;;;
422;14623543;Interest In Crypto Tattoos Balloons 222% This Year – ‘Bitcoin Ink,’ Anyone?;BTC;;;bitcoinist.com;https://cryptopanic.com/news/14623543/Interest-In-Crypto-Tattoos-Balloons-222-This-Year-Bitcoin-Ink-Anyone;2022.03.19;2;;;;3;;;
423;14623542;За четвертый квартал 2022 года пользователи провели 100 млн скачиваний криптовалютных приложений;;;;bitnovosti.com;https://cryptopanic.com/news/14623542/2022-100;2022.03.19;;;;;;;;
424;14623545;Биткоин-биржа WhiteBIT объявила об интеграции с «Дiя»;;;;forklog.com;https://cryptopanic.com/news/14623545/-WhiteBIT-i;2022.03.19;;;;;;1;;
425;14625516;The #BinanceBlockchainWeek speaker line-up keeps getting better. @Forbes' Vice President in Corporate Development…;BNB;ETHDOWN;ETHUP;@binance;https://cryptopanic.com/news/14625516/The-BinanceBlockchainWeek-speaker-line-up-keeps-getting-better-Forbes-Vice-President-in-Corporate-Development;2022.03.19;;;;;;;;
426;14623540;Bored Ape’s ApeCoin (APE) off to Rocky Start After Launch;APE;;;beincrypto.com;https://cryptopanic.com/news/14623540/Bored-Apes-ApeCoin-APE-off-to-Rocky-Start-After-Launch;2022.03.19;1;;1;1;1;;;1
427;14623526;Who Pays For Ethereum’s Complexity? A Lead Developer Speaks Up;ETH;;;bitcoinist.com;https://cryptopanic.com/news/14623526/Who-Pays-For-Ethereums-Complexity-A-Lead-Developer-Speaks-Up;2022.03.19;;;1;;;;;
428;14623476;This Elon Musk’s Tweet Carries Hidden DOGE Message, Twitter User Claims;DOGE;;;u.today;https://cryptopanic.com/news/14623476/This-Elon-Musks-Tweet-Carries-Hidden-DOGE-Message-Twitter-User-Claims;2022.03.19;7;5;5;7;4;8;7;1
429;14623509;Play-to-Earn Altcoin Project Soars 1,176% in Just 30 Days, Surpassing $2,000,000,000 Market Cap;XIDO;MKR;;dailyhodl.com;https://cryptopanic.com/news/14623509/Play-to-Earn-Altcoin-Project-Soars-1176-in-Just-30-Days-Surpassing-2000000000-Market-Cap;2022.03.19;1;;;;;;;
430;14623227;Bitcoin beats owning COIN stock by 20% since Coinbase IPO;BTC;;;cointelegraph.com;https://cryptopanic.com/news/14623227/Bitcoin-beats-owning-COIN-stock-by-20-since-Coinbase-IPO;2022.03.19;;;;;;;;
431;14623266;ADA’s Total Value Locked Could Surpass $1 Billion;ADA;;;usethebitcoin.com;https://cryptopanic.com/news/14623266/ADAs-Total-Value-Locked-Could-Surpass-1-Billion;2022.03.19;17;3;10;;15;1;1;1
432;14621048;Time to settle this;ION;OSMO;;@osmosiszone;https://cryptopanic.com/news/14621048/Time-to-settle-this;2022.03.19;;;;;;;;
433;14620908;Crypto Markets Add $80B in a Day as Bitcoin Touched $42K (Weekend Watch);BTC;ETH;;;https://cryptopanic.com/news/14620908/Crypto-Markets-Add-80B-in-a-Day-as-Bitcoin-Touched-42K-Weekend-Watch;2022.03.19;1;;;1;;;;
434;14625517;me at home 24/7;BNB;ETHDOWN;ETHUP;@binance;https://cryptopanic.com/news/14625517/me-at-home-247;2022.03.19;;;;;;;;
435;14620909;Сооснователь Dogecoin: токен ApeCoin от BAYC вредит NFT-сегменту;DOGE;APE;;forklog.com;https://cryptopanic.com/news/14620909/Dogecoin-ApeCoin-BAYC-NFT-;2022.03.19;;;;;;;;
436;14620356;Binance Shuts Down Ontario Users From Its Platform – Will It Restrict Other Canadian Provinces?;;;;bitcoinist.com;https://cryptopanic.com/news/14620356/Binance-Shuts-Down-Ontario-Users-From-Its-Platform-Will-It-Restrict-Other-Canadian-Provinces;2022.03.19;1;1;;;1;1;2;
437;14619661;BlockFi confirms unauthorized access to client data hosted on Hubspot;;;;cointelegraph.com;https://cryptopanic.com/news/14619661/BlockFi-confirms-unauthorized-access-to-client-data-hosted-on-Hubspot;2022.03.19;1;;;;1;;;
438;14620641;One Ethereum Competitor Has ‘Lots of Fuel Left in the Tank’, According to Coin Bureau;ETH;FTM;;dailyhodl.com;https://cryptopanic.com/news/14620641/One-Ethereum-Competitor-Has-Lots-of-Fuel-Left-in-the-Tank-According-to-Coin-Bureau;2022.03.19;;;;;2;;;
439;14619325;Binance не будет работать в Онтарио. Теперь уже точно;;;;bitnovosti.com;https://cryptopanic.com/news/14619325/Binance;2022.03.19;;;;;;;;
440;14617129;Adobe Backed Behance Integrates Feature For Solana NFTs;SOL;FLOW;;bitcoinist.com;https://cryptopanic.com/news/14617129/Adobe-Backed-Behance-Integrates-Feature-For-Solana-NFTs;2022.03.19;10;1;1;3;10;1;1;3
441;14616247;European ‘MiCA’ regulation on digital assets: Where do we stand?;;;;cointelegraph.com;https://cryptopanic.com/news/14616247/European-MiCA-regulation-on-digital-assets-Where-do-we-stand;2022.03.19;;;;;;;;
442;14617036;So you want to play #BitcoinButton but you're unsure on some of the mechanics. Hopefully these FAQs help;BNB;ETHDOWN;ETHUP;@binance;https://cryptopanic.com/news/14617036/So-you-want-to-play-BitcoinButton-but-youre-unsure-on-some-of-the-mechanics-Hopefully-these-FAQs-help;2022.03.19;;;;;;;;
443;14617902;RT @Cryptocom_Insto: Trade ApeCoin $APEUSD Perpetual Contract in the Derivatives Exchange! 2.7M TPS matching engine Full control of yo…;MCO;CRO;WCRO;@cryptocom;https://cryptopanic.com/news/14617902/RT-Cryptocom_Insto-Trade-ApeCoin-APEUSD-Perpetual-Contract-in-the-Derivatives-Exchange-27M-TPS-matching-engine-Full-control-of-yo;2022.03.19;;;;;;;;
444;14616202;Huobi x @SpaceMisfits #AMA! 🤑 $2000 in $SMCW Shared! 1. Follow @HuobiGlobal, @DujunX and @SpaceMisfits 2. Retwee…;HT;HPT;HBTC;@huobiglobal;https://cryptopanic.com/news/14616202/Huobi-x-SpaceMisfits-AMA-2000-in-SMCW-Shared-1-Follow-HuobiGlobal-DujunX-and-SpaceMisfits-2-Retwee;2022.03.19;;;;;;;;
445;14616170;Crypto Adoption in the Spotlight During Russian Invasion of Ukraine;;;;dailyhodl.com;https://cryptopanic.com/news/14616170/Crypto-Adoption-in-the-Spotlight-During-Russian-Invasion-of-Ukraine;2022.03.19;4;;4;;3;;;1
446;14616141;Ethereum ($ETH) Whale Adds 271 Billion Shiba Inu ($SHIB) to Its Stash Amid Ongoing Accumulation;ETH;SHIB;;cryptoglobe.com;https://cryptopanic.com/news/14616141/Ethereum-ETH-Whale-Adds-271-Billion-Shiba-Inu-SHIB-to-Its-Stash-Amid-Ongoing-Accumulation;2022.03.19;9;;2;2;5;1;;
447;14617037;Investing on a recurring basis allows you to grow your assets over time - #Binance supports crypto recurring invest…;BNB;ETHDOWN;ETHUP;@binance;https://cryptopanic.com/news/14617037/Investing-on-a-recurring-basis-allows-you-to-grow-your-assets-over-time-Binance-supports-crypto-recurring-invest;2022.03.19;1;;;;;;;1
448;14616604;RT @yugalabs: See you on the Otherside in April. Powered by @apecoin;APE;;;@apecoin;https://cryptopanic.com/news/14616604/RT-yugalabs-See-you-on-the-Otherside-in-April-Powered-by-apecoin;2022.03.19;1;;;;1;;;
449;14622641;#TUSD is launched on @YieldApp ! Earn up to 14% p.a. of $TUSD on #YieldApp. @YieldApp unlocks the full potenti…;TUSD;;;@tusd_official;https://cryptopanic.com/news/14622641/TUSD-is-launched-on-YieldApp-Earn-up-to-14-pa-of-TUSD-on-YieldApp-YieldApp-unlocks-the-full-potenti;2022.03.19;;;;;;;;
450;14616100;#Huobi - for everyone, anytime, anywhere.;HT;HPT;HBTC;@huobiglobal;https://cryptopanic.com/news/14616100/Huobi-for-everyone-anytime-anywhere;2022.03.19;;;;;;;;
451;14616082;Bitcoin Lightning Network Continues To Grow;BTC;;;bitcoinmagazine.com;https://cryptopanic.com/news/14616082/Bitcoin-Lightning-Network-Continues-To-Grow;2022.03.19;1;;1;;;;;
452;14616078;Real health benefits will come when medicine and the Metaverse collide;;;;cointelegraph.com;https://cryptopanic.com/news/14616078/Real-health-benefits-will-come-when-medicine-and-the-Metaverse-collide;2022.03.19;;;1;;1;4;3;
453;14619169;RT @MirandusGame: ️ GIVEAWAY ️ In case you didn't crack yesterday's cryptic scroll, we're giving away a free Exemplar! Doth thou be fe…;GALA;TOWN;;@gogalagames;https://cryptopanic.com/news/14619169/RT-MirandusGame-GIVEAWAY-In-case-you-didnt-crack-yesterdays-cryptic-scroll-were-giving-away-a-free-Exemplar-Doth-thou-be-fe;2022.03.19;;;;;;;;
454;14616008;Shiba Inu ($SHIB) and Dogecoin ($DOGE) Accepted by First REIT Accepting Crypto;DOGE;SHIB;;cryptoglobe.com;https://cryptopanic.com/news/14616008/Shiba-Inu-SHIB-and-Dogecoin-DOGE-Accepted-by-First-REIT-Accepting-Crypto;2022.03.19;15;3;3;2;9;2;;3
455;14616605;"RT @fvckrender: METALLOPHYTE// FIRST 1/1 nft that takes $APE @BoredApeYC Thanks @manifoldxyz @yungwknd &lt;3 Starting bid: 1000 $APE https…";APE;;;@apecoin;https://cryptopanic.com/news/14616605/RT-fvckrender-METALLOPHYTE-FIRST-11-nft-that-takes-APE-BoredApeYC-Thanks-manifoldxyz-yungwknd-lt3-Starting-bid-1000-APE-https;2022.03.19;;;;;;;;
456;14616730;RT @ryanology045: 1/ In line with @anchor_protocol’s 1st birthday, Anchor has taken its first step to the interchain.  Powered by @wormhol…;AVAX;WAVAX;AVAX;@avalancheavax;https://cryptopanic.com/news/14616730/RT-ryanology045-1-In-line-with-anchor_protocols-1st-birthday-Anchor-has-taken-its-first-step-to-the-interchain-Powered-by-wormhol;2022.03.19;;;;;;;;
457;14622338;RT @THORmaximalist: 1. Day 3/30 of @THORChain threads Today : Value capture. Why utility and tokens price don't always go hand in hand a…;RUNE;;;@thorchain;https://cryptopanic.com/news/14622338/RT-THORmaximalist-1-Day-330-of-THORChain-threads-Today-Value-capture-Why-utility-and-tokens-price-dont-always-go-hand-in-hand-a;2022.03.19;;;;;;;;
458;14622488;The Sandbox GMAE Show 3/18 - 4 Alpha Passes in the Rusty Cliffs!;SAND;;;@thesandboxgame;https://cryptopanic.com/news/14622488/The-Sandbox-GMAE-Show-318-4-Alpha-Passes-in-the-Rusty-Cliffs;2022.03.19;;;;;;;;
459;14615954;Facebook sued in Australia for fake crypto ads;;;;cryptoslate.com;https://cryptopanic.com/news/14615954/Facebook-sued-in-Australia-for-fake-crypto-ads;2022.03.19;4;1;2;1;5;;1;
460;14617523;Secure on-chain randomness helps smart contract developers across the multichain ecosystem create #NFT projects and…;LINK;;;@chainlink;https://cryptopanic.com/news/14617523/Secure-on-chain-randomness-helps-smart-contract-developers-across-the-multichain-ecosystem-create-NFT-projects-and;2022.03.19;;;;;;;;
461;14615900;Coinbase Supports Solana Tokens And NFTs. What’s Next?;SOL;NEAR;FLOW;bitcoinist.com;https://cryptopanic.com/news/14615900/Coinbase-Supports-Solana-Tokens-And-NFTs-Whats-Next;2022.03.19;4;;1;1;5;;;2
462;14618898;1/ The #Web3 Hacker House ran from Mar 14th to Mar 15th! Attendees got to participate in mini hackathons and worksh…;FIL;FIL12;FIL36;@filecoin;https://cryptopanic.com/news/14618898/1-The-Web3-Hacker-House-ran-from-Mar-14th-to-Mar-15th-Attendees-got-to-participate-in-mini-hackathons-and-worksh;2022.03.19;;;;;;;;
463;14616731;RT @DeltaPrimeDefi: Last batch Wolf-of-DeFi NFTs!️ Every NFT magically opens the doors to the DeltaPrime platform 19th of March at 2pm UT…;AVAX;WAVAX;AVAX;@avalancheavax;https://cryptopanic.com/news/14616731/RT-DeltaPrimeDefi-Last-batch-Wolf-of-DeFi-NFTs-Every-NFT-magically-opens-the-doors-to-the-DeltaPrime-platform-19th-of-March-at-2pm-UT;2022.03.19;;;;;;;;
464;14619374;The Hedera22 Hackathon is less than 2 weeks away! Let's introduce you to a challenge a day that will put you and…;HBAR;;;@hedera;https://cryptopanic.com/news/14619374/The-Hedera22-Hackathon-is-less-than-2-weeks-away-Lets-introduce-you-to-a-challenge-a-day-that-will-put-you-and;2022.03.19;;;;;;;;
465;14615851;Fund Manager Jim Chanos Says He’s Shorting Coinbase;;;;coindesk.com;https://cryptopanic.com/news/14615851/Fund-Manager-Jim-Chanos-Says-Hes-Shorting-Coinbase;2022.03.19;;1;;2;;1;;
466;14615843;The quote tweets on the new time article about me are truly amazing. These are barely even cherry picked, it's pre…;ETH;;;@vitalikbuterin;https://cryptopanic.com/news/14615843/The-quote-tweets-on-the-new-time-article-about-me-are-truly-amazing-These-are-barely-even-cherry-picked-its-pre;2022.03.19;;;;;;;;
467;14622414;The @sig_finance paper is out Options on Terra are almost upon us.;UST;LUNA;KRT;@terra_money;https://cryptopanic.com/news/14622414/The-sig_finance-paper-is-out-Options-on-Terra-are-almost-upon-us;2022.03.19;;;;;;;;
468;14616732;RT @KyberNetwork: @avalancheavax fans rejoice as #KyberSwap begins Phase 2 #AvalancheRush with ~$1M in rewards! 🤑 Learn more;AVAX;WAVAX;AVAX;@avalancheavax;https://cryptopanic.com/news/14616732/RT-KyberNetwork-avalancheavax-fans-rejoice-as-KyberSwap-begins-Phase-2-AvalancheRush-with-1M-in-rewards-Learn-more;2022.03.19;;;;;;;;
469;14615845;Here’s What Will Push Bitcoin To $1 Million, According to BitMex Founder;BTC;;;bitcoinist.com;https://cryptopanic.com/news/14615845/Heres-What-Will-Push-Bitcoin-To-1-Million-According-to-BitMex-Founder;2022.03.19;;;;2;6;1;;1
470;14617038;Going abroad? With #Binance P2P, you can convert to local currencies, all with zero fees!;BNB;ETHDOWN;ETHUP;@binance;https://cryptopanic.com/news/14617038/Going-abroad-With-Binance-P2P-you-can-convert-to-local-currencies-all-with-zero-fees;2022.03.19;;;;;;;;
471;14615822;Bitcoin Can Be The Foundation Of Human Rights;BTC;;;bitcoinmagazine.com;https://cryptopanic.com/news/14615822/Bitcoin-Can-Be-The-Foundation-Of-Human-Rights;2022.03.19;2;;1;1;2;;1;
472;14615825;$ADA Whale Says Cardano TVL Is ‘Going Into the Billions Soon’;ADA;;;cryptoglobe.com;https://cryptopanic.com/news/14615825/ADA-Whale-Says-Cardano-TVL-Is-Going-Into-the-Billions-Soon;2022.03.19;30;6;14;5;24;4;6;3
473;14622415;Here comes Alice @alice_finance;UST;LUNA;KRT;@terra_money;https://cryptopanic.com/news/14622415/Here-comes-Alice-alice_finance;2022.03.19;;;;;;;;
474;14616606;RT @bejado: $APE Rules Everything Around Me;APE;;;@apecoin;https://cryptopanic.com/news/14616606/RT-bejado-APE-Rules-Everything-Around-Me;2022.03.19;;;;;;;;
475;14618827;Let's make it happen, ₿rady. But what do you say, we give him a #bitcoin too?;FTT;HOLY;BITO;@ftx_official;https://cryptopanic.com/news/14618827/Lets-make-it-happen-rady-But-what-do-you-say-we-give-him-a-bitcoin-too;2022.03.19;;;;;;;;
476;14615766;Crypto.com Extends Support to Low-Cap Messaging Altcoin That Coinbase Recently Listed;;;;dailyhodl.com;https://cryptopanic.com/news/14615766/Cryptocom-Extends-Support-to-Low-Cap-Messaging-Altcoin-That-Coinbase-Recently-Listed;2022.03.19;1;;1;;1;;;
477;14615767;Here’s Why Bitcoin (BTC) Will Eventually See a $1,000,000 Price Tag, According to BitMEX Co-Founder Arthur Hayes;BTC;;;dailyhodl.com;https://cryptopanic.com/news/14615767/Heres-Why-Bitcoin-BTC-Will-Eventually-See-a-1000000-Price-Tag-According-to-BitMEX-Co-Founder-Arthur-Hayes;2022.03.19;1;;;;2;1;;
478;14622489;The Doberguard has the munchies… Did you grab him something to eat? 🥪 It's definitely worth your while!…;SAND;;;@thesandboxgame;https://cryptopanic.com/news/14622489/The-Doberguard-has-the-munchies-Did-you-grab-him-something-to-eat-Its-definitely-worth-your-while;2022.03.19;;;;;;;;
479;14615752;Here’s how onXRP protects your NFTs against duplication and data-loss;;;;cryptoslate.com;https://cryptopanic.com/news/14615752/Heres-how-onXRP-protects-your-NFTs-against-duplication-and-data-loss;2022.03.19;;;1;;1;1;;
480;14615753;Ethereum Outflows From Exchanges Hit 2022 Peak as ETH Price Surges;ETH;;;decrypt.co;https://cryptopanic.com/news/14615753/Ethereum-Outflows-From-Exchanges-Hit-2022-Peak-as-ETH-Price-Surges;2022.03.19;4;;2;;3;;;1
481;14615705;NFT collections brought to life at SXSW: Doodles and FLUF World;;;;cointelegraph.com;https://cryptopanic.com/news/14615705/NFT-collections-brought-to-life-at-SXSW-Doodles-and-FLUF-World;2022.03.19;;;;;;1;1;
482;14615694;FTX CEO Criticizes Industry Stance on Russia Sanctions;;;;cryptobriefing.com;https://cryptopanic.com/news/14615694/FTX-CEO-Criticizes-Industry-Stance-on-Russia-Sanctions;2022.03.19;;1;1;5;;1;1;
483;14615690;This Week’s Biggest Losers: Terra (LUNA) Drops After March ATH;LUNA;LUNA;;beincrypto.com;https://cryptopanic.com/news/14615690/This-Weeks-Biggest-Losers-Terra-LUNA-Drops-After-March-ATH;2022.03.19;2;1;;;1;1;1;
484;14615691;What Is ApeCoin and Who Is Behind It?;APE;;;coindesk.com;https://cryptopanic.com/news/14615691/What-Is-ApeCoin-and-Who-Is-Behind-It;2022.03.19;;1;;;1;1;1;
485;14619747;With @DefiLlama now tracking #DeFi projects on @Kadena_io, we're excited that users can directly see the explosive…;KDA;;;@kadena_io;https://cryptopanic.com/news/14619747/With-DefiLlama-now-tracking-DeFi-projects-on-Kadena_io-were-excited-that-users-can-directly-see-the-explosive;2022.03.19;;;;;;;;
486;14615657;FTX, Animoca Back $500M Crypto Gaming Platform on Terra;LUNA;LUNA;;decrypt.co;https://cryptopanic.com/news/14615657/FTX-Animoca-Back-500M-Crypto-Gaming-Platform-on-Terra;2022.03.19;1;;;;1;;;1
487;14616607;RT @offshoot3D: Apecoin.;APE;;;@apecoin;https://cryptopanic.com/news/14616607/RT-offshoot3D-Apecoin;2022.03.19;;;;;;;;
488;14615644;14% of Salvadoran businesses have transacted in BTC: Chamber of Commerce;BTC;;;cointelegraph.com;https://cryptopanic.com/news/14615644/14-of-Salvadoran-businesses-have-transacted-in-BTC-Chamber-of-Commerce;2022.03.19;10;;2;;5;;;
489;14619382;Where in the world are you building #ThePeoplesNetwork from ? Drop a response and make sure to have DMs open for a…;HNT;;;@helium;https://cryptopanic.com/news/14619382/Where-in-the-world-are-you-building-ThePeoplesNetwork-from-Drop-a-response-and-make-sure-to-have-DMs-open-for-a;2022.03.19;;;;;;;;
490;14615626;GameStop Plans NFT Marketplace for Q2 This Year;;;;cryptobriefing.com;https://cryptopanic.com/news/14615626/GameStop-Plans-NFT-Marketplace-for-Q2-This-Year;2022.03.19;1;;;;;1;1;
491;14615622;#Chainlink and #blockchains can help track and reward eco-friendly behavior. In this @SCRForum post,…;LINK;;;@smart_contract;https://cryptopanic.com/news/14615622/Chainlink-and-blockchains-can-help-track-and-reward-eco-friendly-behavior-In-this-SCRForum-post;2022.03.19;;;;;;;;
492;14619170;Go follow @TheVOXverse to stay updated on everything #VOX!;GALA;TOWN;;@gogalagames;https://cryptopanic.com/news/14619170/Go-follow-TheVOXverse-to-stay-updated-on-everything-VOX;2022.03.19;;;;;;;;
493;14620571;[A thread 1/10] March’s ecosystem update featuring the latest progress by the #MinaCommunity is here! An exciting…;MINA;MINA;;@minaprotocol;https://cryptopanic.com/news/14620571/A-thread-110-Marchs-ecosystem-update-featuring-the-latest-progress-by-the-MinaCommunity-is-here-An-exciting;2022.03.19;;;;;;;;
494;14615625;Crypto Bull V. Matador: Chainalysis & Sen. Warren Argy-Bargy;;;;bitcoinist.com;https://cryptopanic.com/news/14615625/Crypto-Bull-V-Matador-Chainalysis-Sen-Warren-Argy-Bargy;2022.03.19;;;;;;;;
495;14615593;Altcoin Roundup: Three layer-1 protocols see inflows amid choppy, volatile market conditions;LUNA;;;cointelegraph.com;https://cryptopanic.com/news/14615593/Altcoin-Roundup-Three-layer-1-protocols-see-inflows-amid-choppy-volatile-market-conditions;2022.03.19;2;;;1;2;;;
496;14622418;RT @anchor_protocol: 1/ Don’t forget to vote on Prop 20 currently live on Anchor to implement a semi-dynamic earn rate!;UST;LUNA;KRT;@terra_money;https://cryptopanic.com/news/14622418/RT-anchor_protocol-1-Dont-forget-to-vote-on-Prop-20-currently-live-on-Anchor-to-implement-a-semi-dynamic-earn-rate;2022.03.19;;;;;;;;
497;14615564;"Start your engines: @blocktrucks has joined the Enjin &amp; #Efinity Ecosystem! The #PlayToEarn offroad multiplayer…";ENJ;EFI;;@enjin;https://cryptopanic.com/news/14615564/Start-your-engines-blocktrucks-has-joined-the-Enjin-amp-Efinity-Ecosystem-The-PlayToEarn-offroad-multiplayer;2022.03.19;;;;;;;;
498;14623383;️New DeFi Download Podcast️ This week on the DeFi Download Podcast @PiersRidyard is joined by the Co-Founder an…;EXRD;XRD;;@radixdlt;https://cryptopanic.com/news/14623383/New-DeFi-Download-Podcast-This-week-on-the-DeFi-Download-Podcast-PiersRidyard-is-joined-by-the-Co-Founder-an;2022.03.19;;;;;;;;
499;14615573;Binance tells regulators it will cease operations in Ontario... for real this time;;;;cointelegraph.com;https://cryptopanic.com/news/14615573/Binance-tells-regulators-it-will-cease-operations-in-Ontario-for-real-this-time;2022.03.19;;1;3;;;2;2;
500;14615575;DAO Treasuries Top $8.2 Billion on Ethereum, $1.3B on Solana: DeepDAO;SOL;;;decrypt.co;https://cryptopanic.com/news/14615575/DAO-Treasuries-Top-82-Billion-on-Ethereum-13B-on-Solana-DeepDAO;2022.03.19;1;;;;;;;
501;14615534;"This week's issue of ""The Baking Sheet"" from @TezosCommons highlights the new Tenderbake consensus mechanism and ho…";XTZ;;;;https://cryptopanic.com/news/14615534/This-weeks-issue-of-The-Baking-Sheet-from-TezosCommons-highlights-the-new-Tenderbake-consensus-mechanism-and-ho;2022.03.19;;;;;;;;
502;14615550;"Tom Brady Has Bitcoin Offer for Unfortunate Buyer of His ""Last"" TD Ball";BTC;;;u.today;https://cryptopanic.com/news/14615550/Tom-Brady-Has-Bitcoin-Offer-for-Unfortunate-Buyer-of-His-Last-TD-Ball;2022.03.19;;;;;1;1;1;1
503;14615571;Russian Central Bank Grants License to Sberbank to Issue Digital Assets;;;;beincrypto.com;https://cryptopanic.com/news/14615571/Russian-Central-Bank-Grants-License-to-Sberbank-to-Issue-Digital-Assets;2022.03.19;1;;;1;;1;;
504;14615519;Market Wrap: Ether Outperforms, Bitcoin Rises Above $42K;BTC;;;coindesk.com;https://cryptopanic.com/news/14615519/Market-Wrap-Ether-Outperforms-Bitcoin-Rises-Above-42K;2022.03.19;1;;;;1;;;
505;14616734;As #Avalanche continues to pioneer vast developments in blockchain, @avalabsofficial joins @BlockchainAssn to help…;AVAX;WAVAX;AVAX;@avalancheavax;https://cryptopanic.com/news/14616734/As-Avalanche-continues-to-pioneer-vast-developments-in-blockchain-avalabsofficial-joins-BlockchainAssn-to-help;2022.03.19;;;;;;;;
506;14618828;RT @Brett_FTXUS: 1/ Cannabis and digital assets;FTT;HOLY;BITO;@ftx_official;https://cryptopanic.com/news/14618828/RT-Brett_FTXUS-1-Cannabis-and-digital-assets;2022.03.19;;;;;;;;
507;14616460;Want to experience working with top-notch tech on an intelligent, fast paced team? Algorand is hiring for a Senior…;ALGO;;;;https://cryptopanic.com/news/14616460/Want-to-experience-working-with-top-notch-tech-on-an-intelligent-fast-paced-team-Algorand-is-hiring-for-a-Senior;2022.03.19;;;;;;;;
508;14617039;We're delighted to have @Microsoft's Managing Director, Roberto Croci is joining us at #BinanceBlockchainWeek! Cat…;BNB;ETHDOWN;ETHUP;@binance;https://cryptopanic.com/news/14617039/Were-delighted-to-have-Microsofts-Managing-Director-Roberto-Croci-is-joining-us-at-BinanceBlockchainWeek-Cat;2022.03.19;;;;;;;;
509;14615507;Here Are the Levels Bitcoin (BTC) Must Hold and Break To Trigger the Market, According to Michaël van de Poppe;BTC;;;dailyhodl.com;https://cryptopanic.com/news/14615507/Here-Are-the-Levels-Bitcoin-BTC-Must-Hold-and-Break-To-Trigger-the-Market-According-to-Michael-van-de-Poppe;2022.03.19;1;;;;1;;;
510;14622470;The @dissrup1 subgraph is live on The Graph’s decentralized network! ️ Dissrup is an NFT platform uniting web3 ar…;GRT;;;@graphprotocol;https://cryptopanic.com/news/14622470/The-dissrup1-subgraph-is-live-on-The-Graphs-decentralized-network-Dissrup-is-an-NFT-platform-uniting-web3-ar;2022.03.19;;;;;;;;
511;14615396;New report suggests RippleNet as an alternative to SWIFT for the Arab world;XRP;;;ambcrypto.com;https://cryptopanic.com/news/14615396/New-report-suggests-RippleNet-as-an-alternative-to-SWIFT-for-the-Arab-world;2022.03.19;9;;4;;7;;;
512;14615366;RT @andrewrchow: Ethereum has changed the world--but not necessarily in ways that its creator, @VitalikButerin, agrees with. My TIME cover…;GNT;;;@julianzawist;https://cryptopanic.com/news/14615366/RT-andrewrchow-Ethereum-has-changed-the-world-but-not-necessarily-in-ways-that-its-creator-VitalikButerin-agrees-with-My-TIME-cover;2022.03.19;;;;;;;;
513;14615372;Without Robots, DAOs Will Never Progress Beyond Their Current Level;;;;coindesk.com;https://cryptopanic.com/news/14615372/Without-Robots-DAOs-Will-Never-Progress-Beyond-Their-Current-Level;2022.03.19;;;;;;;;
514;14615373;El Salvador’s Bitcoin Bond Issuance Apparently Delayed;BTC;;;coindesk.com;https://cryptopanic.com/news/14615373/El-Salvadors-Bitcoin-Bond-Issuance-Apparently-Delayed;2022.03.19;1;;;;1;;;
515;14615337;RT @BitcoinMagazine: #Bitcoin's Lightning Network can currently perform over 1,000 times as much transactions as Visa;BTC;BCH;;@bitcoin;https://cryptopanic.com/news/14615337/RT-BitcoinMagazine-Bitcoins-Lightning-Network-can-currently-perform-over-1000-times-as-much-transactions-as-Visa;2022.03.19;;;;;;1;;
516;14618829;RT @TomBrady: Hey @FTX_Official …could we donate a Bitcoin to the charity of this person’s choice?!;FTT;HOLY;BITO;@ftx_official;https://cryptopanic.com/news/14618829/RT-TomBrady-Hey-FTX_Official-could-we-donate-a-Bitcoin-to-the-charity-of-this-persons-choice;2022.03.19;;;;;;;;
517;14615351;Universal Music’s Web3 Label Acquires Bored Ape NFT for $360,000;;;;blockworks.co;https://cryptopanic.com/news/14615351/Universal-Musics-Web3-Label-Acquires-Bored-Ape-NFT-for-360000;2022.03.19;1;;;;;;;
518;14615315;Range bound for a month.;BTC;BCH;;@bitcoin;https://cryptopanic.com/news/14615315/Range-bound-for-a-month;2022.03.19;;;;;;;;
