;_id;news_title;first_crypto;second_crypto;third_crypto;source;news_link;publication_date;pos_votes;neg_votes;imp_votes;com_votes;like_votes;dislike_votes;lol_votes;save_votes
412;14758683;🥞SOLD!! To the highest bidders. The winning farms will be going live for one week at 1x multiplier, within 48 hou…;CAKE;;;@pancakeswap;https://cryptopanic.com/news/14758683/SOLD-To-the-highest-bidders-The-winning-farms-will-be-going-live-for-one-week-at-1x-multiplier-within-48-hou;2022.03.31;;;;;;;;
413;14750478;Shiba Inu готовит к запуску собственную метавселенную – SHIB: The Metaverse;ETH;SHIB;;incrypted.net;https://cryptopanic.com/news/14750478/Shiba-Inu-SHIB-The-Metaverse;2022.03.31;;;;;;;;
414;14750138;Seven common mistakes crypto investors and traders make;BTC;;;cointelegraph.com;https://cryptopanic.com/news/14750138/Seven-common-mistakes-crypto-investors-and-traders-make;2022.03.31;;;;;1;;;1
415;14750155;СМИ: BitMEX отказалась от поглощения банка Bankhaus von der Heydt;;;;forklog.com;https://cryptopanic.com/news/14750155/BitMEX-Bankhaus-von-der-Heydt;2022.03.31;;;;;;;;
417;14750129;By integrating multiple #Chainlink services, @AtlasCorp_dcl was able to build a more secure NFT-based football game…;LINK;;;@smart_contract;https://cryptopanic.com/news/14750129/By-integrating-multiple-Chainlink-services-AtlasCorp_dcl-was-able-to-build-a-more-secure-NFT-based-football-game;2022.03.31;;;;;;;;
418;14750432;Мобильный кошелек 1inch Wallet получил версию для Android;;;;incrypted.net;https://cryptopanic.com/news/14750432/1inch-Wallet-Android;2022.03.31;;;;;;;;
419;14760188;(1/2) Thrilled to share that I’ve purchased the complete set of “12 Digital Zodiac Heads” created by MetaPolyXM, a…;TRX;;;@justinsuntron;https://cryptopanic.com/news/14760188/12-Thrilled-to-share-that-Ive-purchased-the-complete-set-of-12-Digital-Zodiac-Heads-created-by-MetaPolyXM-a;2022.03.31;;;;;;;;
420;14753087;RT @Algomint_io: We are proud to launch the $goMINT token. Read more about this huge project milestone below. Acquire the token today on @a…;ALGO;;;@algofoundation;https://cryptopanic.com/news/14753087/RT-Algomint_io-We-are-proud-to-launch-the-goMINT-token-Read-more-about-this-huge-project-milestone-below-Acquire-the-token-today-on-a;2022.03.31;;;;;;;;
421;14755736;Upcoming listing on FTX: $JASMY perpetual futures! @JasmyMGT Listing details;FTT;HOLY;BITO;@ftx_official;https://cryptopanic.com/news/14755736/Upcoming-listing-on-FTX-JASMY-perpetual-futures-JasmyMGT-Listing-details;2022.03.31;;;;;;;;
422;14750092;Alpha Venture DAO Transforms Web3 Project Incubation Through Community Focus;LUNA;LUNA;UST;newsbtc.com;https://cryptopanic.com/news/14750092/Alpha-Venture-DAO-Transforms-Web3-Project-Incubation-Through-Community-Focus;2022.03.31;;;;;;;;
423;14750135;Alpha Finance Lab Launches Alpha Venture DAO To Support And Advance Web3 Innovation Efforts;;;;;https://cryptopanic.com/news/14750135/Alpha-Finance-Lab-Launches-Alpha-Venture-DAO-To-Support-And-Advance-Web3-Innovation-Efforts;2022.03.31;;;;;;;;
424;14750157;Binance announces web3 partnership with Grammy organization;;;;theblockcrypto.com;https://cryptopanic.com/news/14750157/Binance-announces-web3-partnership-with-Grammy-organization;2022.03.31;2;;2;;3;;;1
425;14755737;Upcoming listing on FTX: $IOST perpetual futures! @IOST_Official Listing details;FTT;HOLY;BITO;@ftx_official;https://cryptopanic.com/news/14755737/Upcoming-listing-on-FTX-IOST-perpetual-futures-IOST_Official-Listing-details;2022.03.31;;;;;;;;
426;14750136;A16z Leads $4.8M Round for P2E Gaming Startup Battlebound;;;;coindesk.com;https://cryptopanic.com/news/14750136/A16z-Leads-48M-Round-for-P2E-Gaming-Startup-Battlebound;2022.03.31;;;;;;;;1
427;14750139;Binance becomes official crypto exchange partner of 64th Grammy Awards;;;;cointelegraph.com;https://cryptopanic.com/news/14750139/Binance-becomes-official-crypto-exchange-partner-of-64th-Grammy-Awards;2022.03.31;2;;1;;2;;;2
428;14750091;Binance signs on as Grammys’ official crypto exchange partner;;;;forkast.news;https://cryptopanic.com/news/14750091/Binance-signs-on-as-Grammys-official-crypto-exchange-partner;2022.03.31;1;;1;;3;;;1
429;14758194;The NEAR March Town Hall is live now! Tune in;NEAR;WNEAR;;@nearprotocol;https://cryptopanic.com/news/14758194/The-NEAR-March-Town-Hall-is-live-now-Tune-in;2022.03.31;;;;;;;;
430;14750095;Stocks Down, Oil Falls, Bitcoin and Gold Slightly Rise;BTC;;;trustnodes.com;https://cryptopanic.com/news/14750095/Stocks-Down-Oil-Falls-Bitcoin-and-Gold-Slightly-Rise;2022.03.31;;;;;;;;1
431;14750083;WeChat Bans Multiple Accounts Associated With NFTs Trading;;;;bitcoinist.com;https://cryptopanic.com/news/14750083/WeChat-Bans-Multiple-Accounts-Associated-With-NFTs-Trading;2022.03.31;;1;;;;1;1;
432;14750058;Ola Finance on Fuse Network suffers $3.6 million hack;;;;theblockcrypto.com;https://cryptopanic.com/news/14750058/Ola-Finance-on-Fuse-Network-suffers-36-million-hack;2022.03.31;;15;7;4;3;2;4;1
433;14750055;BitMEX CEO, CFO's Bid for German Bank Fails: Report;;;;coindesk.com;https://cryptopanic.com/news/14750055/BitMEX-CEO-CFOs-Bid-for-German-Bank-Fails-Report;2022.03.31;;;;;;;;
434;14750056;Binance открыла более 100 вакансий для работы в Дубае;;;;forklog.com;https://cryptopanic.com/news/14750056/Binance-100;2022.03.31;;;;;;;;
435;14750060;Shiba Inu Teases a Year Full of Other Surprises, Here Are Its Plans for Development;SHIB;;;u.today;https://cryptopanic.com/news/14750060/Shiba-Inu-Teases-a-Year-Full-of-Other-Surprises-Here-Are-Its-Plans-for-Development;2022.03.31;13;4;5;4;8;2;4;2
436;14750008;New Listing on #Huobi! $AMP @amptoken Deposits open Trading starts soon;HT;HPT;HBTC;@huobiglobal;https://cryptopanic.com/news/14750008/New-Listing-on-Huobi-AMP-amptoken-Deposits-open-Trading-starts-soon;2022.03.31;;;;;;;;
437;14749998;Crypto community bets Cardano to trade at $1.35 by April 30;ADA;;;finbold.com;https://cryptopanic.com/news/14749998/Crypto-community-bets-Cardano-to-trade-at-135-by-April-30;2022.03.31;19;8;14;1;21;6;4;3
438;14749999;Dogecoin could advance towards $0.21 ‘with no hesitation,’ says crypto trading expert;DOGE;;;finbold.com;https://cryptopanic.com/news/14749999/Dogecoin-could-advance-towards-021-with-no-hesitation-says-crypto-trading-expert;2022.03.31;6;;5;1;8;;;1
439;14751042;Сооснователь Ripple предложил перевести Биткоин на Proof-of-Stake. Криптосообщество раскритиковало идею;BTC;XRP;;2bitcoins.ru;https://cryptopanic.com/news/14751042/Ripple-Proof-of-Stake;2022.03.31;;;;;;;;
440;14753702;Live now: @ToniKroos NFT Mystery Box collection! For the unaware, Toni Kroos is a professional footballer at…;BNB;ETHDOWN;ETHUP;@binance;https://cryptopanic.com/news/14753702/Live-now-ToniKroos-NFT-Mystery-Box-collection-For-the-unaware-Toni-Kroos-is-a-professional-footballer-at;2022.03.31;;;;;;;;
441;14750014;Biden Executive Order, Ukraine War Present US Lawmakers an Unprecedented Crypto Learning Opportunity;;;;;https://cryptopanic.com/news/14750014/Biden-Executive-Order-Ukraine-War-Present-US-Lawmakers-an-Unprecedented-Crypto-Learning-Opportunity;2022.03.31;1;;;;;;;
442;14749968;Kraken Exchange Integrates Bitcoin’s Lightning Network;BTC;;;bitcoinmagazine.com;https://cryptopanic.com/news/14749968/Kraken-Exchange-Integrates-Bitcoins-Lightning-Network;2022.03.31;14;;8;;9;;1;1
443;14754242;RT @BarclaysCIB: Smart contracts are the future, says @Chainlink Co-founder @SergeyNazarov to participants at our #BarcCrypto summit. As th…;LINK;;;@chainlink;https://cryptopanic.com/news/14754242/RT-BarclaysCIB-Smart-contracts-are-the-future-says-Chainlink-Co-founder-SergeyNazarov-to-participants-at-our-BarcCrypto-summit-As-th;2022.03.31;;;;;;;;
444;14750015;First Mover Americas: Ether-Bitcoin Ratio on Track for Monthly Gain;;;;coindesk.com;https://cryptopanic.com/news/14750015/First-Mover-Americas-Ether-Bitcoin-Ratio-on-Track-for-Monthly-Gain;2022.03.31;1;;1;;1;;1;
445;14749931;Hedera Use Case #046 - Ready Doc by Intiva Health;HBAR;;;r/hedera;https://cryptopanic.com/news/14749931/Hedera-Use-Case-046-Ready-Doc-by-Intiva-Health;2022.03.31;;;;;;;;
446;14749947;Токен SHIB за неделю подскочил почти на 15%;SHIB;;;coinspot.io;https://cryptopanic.com/news/14749947/SHIB-15;2022.03.31;;;;;;;;
447;14759008;Verite, the open-source framework for decentralized identity, is coming to Polygon! It will provide users with sec…;MATIC;;;@0xpolygon;https://cryptopanic.com/news/14759008/Verite-the-open-source-framework-for-decentralized-identity-is-coming-to-Polygon-It-will-provide-users-with-sec;2022.03.31;;;;;;;;
448;14749969;EU Parliament Passes Privacy-Busting Crypto Rules Despite Industry Criticism;;;;coindesk.com;https://cryptopanic.com/news/14749969/EU-Parliament-Passes-Privacy-Busting-Crypto-Rules-Despite-Industry-Criticism;2022.03.31;;6;2;1;;4;;1
449;14750722;Resale is Banned Says Chinese Social Network WeChat After Banning NFT Accounts;;;;ethereumworldnews.com;https://cryptopanic.com/news/14750722/Resale-is-Banned-Says-Chinese-Social-Network-WeChat-After-Banning-NFT-Accounts;2022.03.31;;;;;;;;
450;14750204;Samsung и Nifty Gateway разрабатывают “первую в мире” Smart TV NFT-платформу;;;;incrypted.net;https://cryptopanic.com/news/14750204/Samsung-Nifty-Gateway-Smart-TV-NFT-;2022.03.31;;;;;;;;
451;14749970;Fed’s Preferred Inflation Gauge Up 6.4% in February to Four-Decade High;BTC;;;coindesk.com;https://cryptopanic.com/news/14749970/Feds-Preferred-Inflation-Gauge-Up-64-in-February-to-Four-Decade-High;2022.03.31;;;;;;;;
452;14749888;India’s 30% Crypto Tax Law To Come Into Effect From April 1, 2022;;;;ethereumworldnews.com;https://cryptopanic.com/news/14749888/Indias-30-Crypto-Tax-Law-To-Come-Into-Effect-From-April-1-2022;2022.03.31;3;7;3;;;3;1;
453;14749874;Zilliqa's 'metaverse' debut pumps ZIL price 350% in just five days — Selloff ahead?;ZIL;;;cointelegraph.com;https://cryptopanic.com/news/14749874/Zilliqas-metaverse-debut-pumps-ZIL-price-350-in-just-five-days-Selloff-ahead;2022.03.31;1;1;1;3;1;;1;1
454;14749837;Azuki NFTs Doubled in Price. Then Holders Got an Airdrop;;;;cryptobriefing.com;https://cryptopanic.com/news/14749837/Azuki-NFTs-Doubled-in-Price-Then-Holders-Got-an-Airdrop;2022.03.31;;1;;;;;;
455;14756572;RT @assembly_net: Do you want to build, launch or scale the #nextgen #dApps and infrastructure on #Assembly ️? Need help? We've got you co…;MIOTA;;;@iota;https://cryptopanic.com/news/14756572/RT-assembly_net-Do-you-want-to-build-launch-or-scale-the-nextgen-dApps-and-infrastructure-on-Assembly-Need-help-Weve-got-you-co;2022.03.31;;;;;;;;
456;14749933;BNY Mellon to Custody Assets Backing Circle's USDC Stablecoin;USDC;;;coindesk.com;https://cryptopanic.com/news/14749933/BNY-Mellon-to-Custody-Assets-Backing-Circles-USDC-Stablecoin;2022.03.31;;;;;;;;1
457;14758684;🥞 Farm Auction #18 starting now! 22 projects join the bidding for Farms this week, bidding $CAKE to win. Watch t…;CAKE;;;@pancakeswap;https://cryptopanic.com/news/14758684/Farm-Auction-18-starting-now-22-projects-join-the-bidding-for-Farms-this-week-bidding-CAKE-to-win-Watch-t;2022.03.31;;;;;;;;
458;14753088;The sign up window for the 3rd period of #Algorand Community Governance opens in just 3 hours until April 14th, 11:…;ALGO;;;;https://cryptopanic.com/news/14753088/The-sign-up-window-for-the-3rd-period-of-Algorand-Community-Governance-opens-in-just-3-hours-until-April-14th-11;2022.03.31;;;;;;;;
459;14749862;CleanSpark inks deal to expand Texas mining capacity by up to 500 megawatts;BTC;;;theblockcrypto.com;https://cryptopanic.com/news/14749862/CleanSpark-inks-deal-to-expand-Texas-mining-capacity-by-up-to-500-megawatts;2022.03.31;;;;;;;;
460;14749857;NEAR Protocol (NEAR) Retraces Half Its Jan Drop;NEAR;;;beincrypto.com;https://cryptopanic.com/news/14749857/NEAR-Protocol-NEAR-Retraces-Half-Its-Jan-Drop;2022.03.31;1;;1;;1;;;1
461;14749934;CleanSpark Aims to Be Among Top Bitcoin Miners With Up to 500MW Expansion;BTC;;;coindesk.com;https://cryptopanic.com/news/14749934/CleanSpark-Aims-to-Be-Among-Top-Bitcoin-Miners-With-Up-to-500MW-Expansion;2022.03.31;;;;;;;;
462;14758968;Join Head Ambassador @chrismalize3 and Ambassador for Events Africa @MeckbachZoe as they host this Polkadot event o…;DOT;DOT;;@polkadot;https://cryptopanic.com/news/14758968/Join-Head-Ambassador-chrismalize3-and-Ambassador-for-Events-Africa-MeckbachZoe-as-they-host-this-Polkadot-event-o;2022.03.31;;;;;;;;
463;14749803;В ЕС напомнили об угрозе криптовалют для финансовой стабильности;;;;forklog.com;https://cryptopanic.com/news/14749803/post-14749803;2022.03.31;;;;;1;;;
464;14749782;The Growing Digital Asset Lifeline in Ukraine;;;;coindesk.com;https://cryptopanic.com/news/14749782/The-Growing-Digital-Asset-Lifeline-in-Ukraine;2022.03.31;1;;;;1;;;
465;14756462;Don't miss our upcoming AMA No. 50 - Developer Focused with our Co-founders @artbrock and @zippy314 . ⏰ April 4th…;HOT;HOT;;@h_o_l_o_;https://cryptopanic.com/news/14756462/Dont-miss-our-upcoming-AMA-No-50-Developer-Focused-with-our-Co-founders-artbrock-and-zippy314-April-4th;2022.03.31;;;;;;;;
466;14749772;A complete career timeline of Binance’s billionaire chief Changpeng Zhao;;;;protos.com;https://cryptopanic.com/news/14749772/A-complete-career-timeline-of-Binances-billionaire-chief-Changpeng-Zhao;2022.03.31;;;;;;;;
467;14749743;Solana’s SOL Highest Gainer Among Major Cryptos as Bitcoin Holds $47K;BTC;SOL;;coindesk.com;https://cryptopanic.com/news/14749743/Solanas-SOL-Highest-Gainer-Among-Major-Cryptos-as-Bitcoin-Holds-47K;2022.03.31;35;2;8;5;26;3;3;2
468;14749722;Arweave or Filecoin? Here’s the clear winner of decentralized storage war;FIL;AR;;ambcrypto.com;https://cryptopanic.com/news/14749722/Arweave-or-Filecoin-Heres-the-clear-winner-of-decentralized-storage-war;2022.03.31;;;;;1;;;
469;14754281;"CC2 WILL become the protocol foundation of a web3 development ecosystem geared around the needs of sports &amp; enterta…";CHZ;PFL;ARG;@chiliz;https://cryptopanic.com/news/14754281/CC2-WILL-become-the-protocol-foundation-of-a-web3-development-ecosystem-geared-around-the-needs-of-sports-amp-enterta;2022.03.31;;;;;;;;
470;14749688;"China’s WeChat bans NFT accounts; Zilliqa token soars";ZIL;;;forkast.news;https://cryptopanic.com/news/14749688/Chinas-WeChat-bans-NFT-accounts-Zilliqa-token-soars;2022.03.31;2;;;;3;;1;
471;14749665;Могут ли ончейн-индикаторы прогнозировать максимумы и минимумы?;;;;bitnovosti.com;https://cryptopanic.com/news/14749665/-;2022.03.31;;;;;;;;
472;14759011;.@Rahatcodes a @0xPolygon advocate, is belting a banger at #PolygonIgnite. #paintitpurple;MATIC;;;@0xpolygon;https://cryptopanic.com/news/14759011/Rahatcodes-a-0xPolygon-advocate-is-belting-a-banger-at-PolygonIgnite-paintitpurple;2022.03.31;;;;;;;;
473;14755827;"Filecoin is making efforts to become the default file storage &amp; retrieval system for #Web3 development. See how…";FIL;FIL12;FIL36;@filecoin;https://cryptopanic.com/news/14755827/Filecoin-is-making-efforts-to-become-the-default-file-storage-amp-retrieval-system-for-Web3-development-See-how;2022.03.31;;;;;;;;
474;14759012;.@SandeepNailwal at #PolygonIgnite drops a hint on the road ahead. #paintitpurple;MATIC;;;@0xpolygon;https://cryptopanic.com/news/14759012/SandeepNailwal-at-PolygonIgnite-drops-a-hint-on-the-road-ahead-paintitpurple;2022.03.31;;;;;;;;
475;14749935;Рыночная стоимость биржи Blockchain.com выросла до 14 млрд долларов после нового раунда финансирования;;;;incrypted.net;https://cryptopanic.com/news/14749935/Blockchaincom-14;2022.03.31;;;;;;;;
476;14749654;BitMEX’s planned acquisition of Bankhaus von der Heydt falls through;;;;theblockcrypto.com;https://cryptopanic.com/news/14749654/BitMEXs-planned-acquisition-of-Bankhaus-von-der-Heydt-falls-through;2022.03.31;;1;;;1;1;1;
477;14753089;Obsessed by the new wave of #DeFi? Put your coding skills to the test or join a team for HackAlgo. Help support…;ALGO;;;;https://cryptopanic.com/news/14753089/Obsessed-by-the-new-wave-of-DeFi-Put-your-coding-skills-to-the-test-or-join-a-team-for-HackAlgo-Help-support;2022.03.31;;;;;;;;
478;14749614;Bloomberg сообщил о получении хакерами данных пользователей Apple и Meta;;;;forklog.com;https://cryptopanic.com/news/14749614/Bloomberg-Apple-Meta;2022.03.31;;;;;;;;
479;14754282;Check out the Chiliz Scoville Knowledgebase $CHZ;CHZ;PFL;ARG;@chiliz;https://cryptopanic.com/news/14754282/Check-out-the-Chiliz-Scoville-Knowledgebase-CHZ;2022.03.31;;;;;;;;
480;14749616;Bitcoin Sees Largest 4-Hour Interval of Whale Transactions Since March 1st As Price Holds Steady;BTC;;;zycrypto.com;https://cryptopanic.com/news/14749616/Bitcoin-Sees-Largest-4-Hour-Interval-of-Whale-Transactions-Since-March-1st-As-Price-Holds-Steady;2022.03.31;25;;8;5;15;;;
481;14749607;Chiliz Plots Sports, Entertainment Crypto Ecosystem With 2.0 Chain;CHZ;;;decrypt.co;https://cryptopanic.com/news/14749607/Chiliz-Plots-Sports-Entertainment-Crypto-Ecosystem-With-20-Chain;2022.03.31;1;;;;1;;;1
482;14749578;Shiba Inu Whales' Holdings Show 103% Increase in Last 24 Hours;SHIB;;;u.today;https://cryptopanic.com/news/14749578/Shiba-Inu-Whales-Holdings-Show-103-Increase-in-Last-24-Hours;2022.03.31;5;1;4;;4;;1;
483;14754283;We're extremely happy to present to you, the CC2 testnet - Chiliz Scoville Testnet ️;CHZ;PFL;ARG;@chiliz;https://cryptopanic.com/news/14754283/Were-extremely-happy-to-present-to-you-the-CC2-testnet-Chiliz-Scoville-Testnet;2022.03.31;;;;;;;;
484;14749562;How The Freedom Convoy Could Have Protected Donation Privacy With Whirlpool;BTC;;;bitcoinmagazine.com;https://cryptopanic.com/news/14749562/How-The-Freedom-Convoy-Could-Have-Protected-Donation-Privacy-With-Whirlpool;2022.03.31;;;;;1;;;
485;14749551;.@TankWarsZone, a play-to-earn game on @FantomFDN, has integrated #Chainlink Price Feeds to help provide its users…;LINK;;;@smart_contract;https://cryptopanic.com/news/14749551/TankWarsZone-a-play-to-earn-game-on-FantomFDN-has-integrated-Chainlink-Price-Feeds-to-help-provide-its-users;2022.03.31;;;;;;;;
486;14749535;Following Rally, Bitcoin and Ethereum Face Resistance;BTC;ETH;;cryptobriefing.com;https://cryptopanic.com/news/14749535/Following-Rally-Bitcoin-and-Ethereum-Face-Resistance;2022.03.31;2;;3;;;;;
487;14749538;В Grayscale Investments сравнили Ethereum с городской инфраструктурой Нью-Йорка;ETH;SOL;AVAX;forklog.com;https://cryptopanic.com/news/14749538/Grayscale-Investments-Ethereum-;2022.03.31;;;;;;;;
488;14749735;This Overlooked Indicator Makes Bitcoin (BTC) Look Attractive at Current Levels: Crypto Analyst Benjamin Cowen;BTC;;;dailyhodl.com;https://cryptopanic.com/news/14749735/This-Overlooked-Indicator-Makes-Bitcoin-BTC-Look-Attractive-at-Current-Levels-Crypto-Analyst-Benjamin-Cowen;2022.03.31;1;;1;;1;;;
489;14754687;RT @kris: If you are a founder thinking which chain to build on, Cronos should be on the top of your list: EVM compatible, fast, low fees a…;MCO;CRO;WCRO;@cryptocom;https://cryptopanic.com/news/14754687/RT-kris-If-you-are-a-founder-thinking-which-chain-to-build-on-Cronos-should-be-on-the-top-of-your-list-EVM-compatible-fast-low-fees-a;2022.03.31;;;;;;;;
490;14754688;RT @kris: has over 2,500 job openings, we are recruiting globally Web3 is the future, let’s build it together h…;MCO;CRO;WCRO;@cryptocom;https://cryptopanic.com/news/14754688/RT-kris-has-over-2500-job-openings-we-are-recruiting-globally-Web3-is-the-future-lets-build-it-together-h;2022.03.31;;;;;;;;
491;14749485;New Listing on #Huobi! $RACA @RadioCacaNFT Deposits open Trading starts soon;HT;HPT;HBTC;@huobiglobal;https://cryptopanic.com/news/14749485/New-Listing-on-Huobi-RACA-RadioCacaNFT-Deposits-open-Trading-starts-soon;2022.03.31;;;;;;;;
492;14749500;US grassroots adoption: the Bitcoin Lightning party in Portland;BTC;;;cointelegraph.com;https://cryptopanic.com/news/14749500/US-grassroots-adoption-the-Bitcoin-Lightning-party-in-Portland;2022.03.31;2;;;;2;;;
493;14749505;Google применит ИИ для обнаружения личных кризисов через поисковые запросы;;;;forklog.com;https://cryptopanic.com/news/14749505/Google;2022.03.31;;;;;;;;
494;14754689;"RT @cryptocomnft: Celebration Drop goes live in 30 minutes Get ready to snag your ""Celebration"" packs and a chance to win a @LoadedLio…";MCO;CRO;WCRO;@cryptocom;https://cryptopanic.com/news/14754689/RT-cryptocomnft-Celebration-Drop-goes-live-in-30-minutes-Get-ready-to-snag-your-Celebration-packs-and-a-chance-to-win-a-LoadedLio;2022.03.31;;;;;;;;
495;14749545;TRON (TRX) Hits New Yearly High;TRX;;;beincrypto.com;https://cryptopanic.com/news/14749545/TRON-TRX-Hits-New-Yearly-High;2022.03.31;2;;1;1;1;;1;
496;14749462;Washington State Passes Bill To Study Benefits of Blockchain Tech;;;;blockworks.co;https://cryptopanic.com/news/14749462/Washington-State-Passes-Bill-To-Study-Benefits-of-Blockchain-Tech;2022.03.31;;;;;;;;
497;14749476;Litecoin Sees a 100% Rise in Large Transactions as Accumulation by Whales Continues;LTC;;;u.today;https://cryptopanic.com/news/14749476/Litecoin-Sees-a-100-Rise-in-Large-Transactions-as-Accumulation-by-Whales-Continues;2022.03.31;8;;5;;7;;3;3
498;14749484;Zilliqa's ZIL Quadruples on Optimism Around Start of Metaverse Service Metapolis;ZIL;;;coindesk.com;https://cryptopanic.com/news/14749484/Zilliqas-ZIL-Quadruples-on-Optimism-Around-Start-of-Metaverse-Service-Metapolis;2022.03.31;;;;;;;;
499;14749459;A little over 12 hours remaining to deposit to Loopring L2 + potentially get your hands on your very own #Loophead…;LRC;LRN;;@loopringorg;https://cryptopanic.com/news/14749459/A-little-over-12-hours-remaining-to-deposit-to-Loopring-L2-potentially-get-your-hands-on-your-very-own-Loophead;2022.03.31;;;;;;;;
500;14749455;On tonight's #VeChainThorsday, @TheVirtualFlame hosts @metatun_vet, a #Multichain open world #NFT #GameFi project f…;VET;VTHO;VEN;@vechainofficial;https://cryptopanic.com/news/14749455/On-tonights-VeChainThorsday-TheVirtualFlame-hosts-metatun_vet-a-Multichain-open-world-NFT-GameFi-project-f;2022.03.31;;;;;;;;
501;14749471;EU is on the verge of ‘bad policy proposals around crypto’, Coinbase CEO reiterates;;;;finbold.com;https://cryptopanic.com/news/14749471/EU-is-on-the-verge-of-bad-policy-proposals-around-crypto-Coinbase-CEO-reiterates;2022.03.31;5;17;28;7;6;13;6;6
502;14749691;Крипто-кешбэк: все больше компаний предлагают своим клиентам возврат средств в криптовалюте;;;;incrypted.net;https://cryptopanic.com/news/14749691/-;2022.03.31;;;;;;;;
503;14753090;.@jackoc_ie will be hosting 'A Night in Paris with Algorand', a special event at the Iconic Galerie Joseph in the P…;ALGO;;;@algofoundation;https://cryptopanic.com/news/14753090/jackoc_ie-will-be-hosting-A-Night-in-Paris-with-Algorand-a-special-event-at-the-Iconic-Galerie-Joseph-in-the-P;2022.03.31;;;;;;;;
504;14749450;Canadian Oil Company to Allocate its Untapped Energy in Mining Bitcoin (Report);BTC;;;cryptopotato.com;https://cryptopanic.com/news/14749450/Canadian-Oil-Company-to-Allocate-its-Untapped-Energy-in-Mining-Bitcoin-Report;2022.03.31;1;;;1;;;;
505;14749451;Ethereum is ‘becoming the collateral of the internet,’ says commodity expert;ETH;;;finbold.com;https://cryptopanic.com/news/14749451/Ethereum-is-becoming-the-collateral-of-the-internet-says-commodity-expert;2022.03.31;29;2;11;8;29;1;2;6
506;14759013;.@SandeepNailwal on what will enhance User Experience even further. #PolygonIgnite #paintitpurple;MATIC;;;@0xpolygon;https://cryptopanic.com/news/14759013/SandeepNailwal-on-what-will-enhance-User-Experience-even-further-PolygonIgnite-paintitpurple;2022.03.31;;;;;;;;
507;14759014;.@SandeepNailwal makes it simple for the world at #PolygonIgnite. #paintitpurple;MATIC;;;@0xpolygon;https://cryptopanic.com/news/14759014/SandeepNailwal-makes-it-simple-for-the-world-at-PolygonIgnite-paintitpurple;2022.03.31;;;;;;;;
508;14758685;The $PEX Farm and Syrup Pool are now live! $PEX-BNB Farm: Stake $CAKE, Earn $PEX:…;CAKE;;;@pancakeswap;https://cryptopanic.com/news/14758685/The-PEX-Farm-and-Syrup-Pool-are-now-live-PEX-BNB-Farm-Stake-CAKE-Earn-PEX;2022.03.31;;;;;;;;
509;14752715;How women artists are bridging the NFT gender gap;;;;forkast.news;https://cryptopanic.com/news/14752715/How-women-artists-are-bridging-the-NFT-gender-gap;2022.03.31;;;;;;;;
510;14760189;#USDT on #TRON has more foreign-exchange reserves than Qatar, Egypt and Nigeria;TRX;;;@justinsuntron;https://cryptopanic.com/news/14760189/USDT-on-TRON-has-more-foreign-exchange-reserves-than-Qatar-Egypt-and-Nigeria;2022.03.31;;;;;;;;
511;14749414;Crypto Industry Mobilizes Against Proposed EU Transparency Rules;;;;coindesk.com;https://cryptopanic.com/news/14749414/Crypto-Industry-Mobilizes-Against-Proposed-EU-Transparency-Rules;2022.03.31;2;;4;;4;1;;2
512;14749405;На соучредителя Ripple Криса Ларсена обрушились с критикой за предложение по переводу биткойна на PoS;;;;bitnovosti.com;https://cryptopanic.com/news/14749405/Ripple-PoS;2022.03.31;;;;;;;;
514;14751751;Blockchain Technology: Revolutionizing the World in 2022 and Beyond;;;;bravenewcoin.com;https://cryptopanic.com/news/14751751/Blockchain-Technology-Revolutionizing-the-World-in-2022-and-Beyond;2022.03.31;;;;;;;;
